{
  "schema_version": "2.0",
  "video_id": "recognition-c12-c16",
  "episode_content_hash": "0ff02b874f079e31e9c1566aa683433144e12c7cf730907e2f0ddec6298a6eab",
  "status": "planning_only_content_approval_required",
  "local_route": [
    "schema and evidence validation",
    "storyboard contact sheet",
    "low-resolution animatic",
    "offline narration",
    "assembly and QA"
  ],
  "remote_route": "disabled_pending_content_approval_and_separate_exact_authorization",
  "estimated_cpu_minutes": 150.0,
  "resource_class": "deterministic-cpu-render-candidate",
  "retry_class": "chapter_hash_identical_only",
  "cache_identities": [
    "92f19d4fd4c8bfc9c9f2f6f4d97a347d2cae13a23a17af8e8c792ec70deed155",
    "572040e0c359017f91ea6413ba8fccf79dfea9f9fe50c9342624eb10dacdfea7",
    "76323736093bde995e191e2d7914599a7ac49a615b83063209cdc428f59d9765",
    "4df67287109b2e43b9d3eebc97904e6db8fc160e10f26022a6168f6f675c5ea4",
    "655f48804cdda7d19626a4a9abab9ba5616f18e91e79a9fcb9eba8f5afc97df5"
  ],
  "expected_outputs": [
    "narration-ready 1920x1080 chapter masters",
    "captions",
    "hash and provenance reports",
    "review contact sheet"
  ],
  "illegal_routes": [
    "network or paid render before content approval",
    "RunPod action without separate exact authorization",
    "generative imagery or video",
    "publication"
  ],
  "content_hash": "edbad9073ac89d93f443a9418cb7a8d5fdc21a7581342be2e85749bc35ec7a72"
}
