{
  "schema_version": "2.0",
  "video_id": "epfl-parity",
  "episode_content_hash": "8cc669a08fcea2fcb9df663faeb5bfa9a71edd184bcbfd8aef90eba7bcc0fba1",
  "status": "planning_only_content_approval_required",
  "local_route": [
    "schema and evidence validation",
    "storyboard contact sheet",
    "low-resolution animatic",
    "offline narration",
    "assembly and QA"
  ],
  "remote_route": "disabled_pending_content_approval_and_separate_exact_authorization",
  "estimated_cpu_minutes": 90.0,
  "resource_class": "deterministic-cpu-render-candidate",
  "retry_class": "chapter_hash_identical_only",
  "cache_identities": [
    "604753705a809e76125e16e3394be5bb5e3e4a004173a2941121337a0a86a497",
    "008356481a5493a2c2121ef719acff43f3e7496bc64d7af9b3abb5f87eff6dce",
    "b21786489750a798d6700f7c0685e2cb13abd13172997ad36fb548c9041dfb2e",
    "47121d9eac8ca04860acfd15cd2ceaf3d39c76663d00b64caaceb1199b4427e7"
  ],
  "expected_outputs": [
    "narration-ready 1920x1080 chapter masters",
    "captions",
    "hash and provenance reports",
    "review contact sheet"
  ],
  "illegal_routes": [
    "network or paid render before content approval",
    "RunPod action without separate exact authorization",
    "generative imagery or video",
    "publication"
  ],
  "content_hash": "274efd70fda1caef770d191f83ea398c4dfb7a9fbad2d7b87aa55b36f3911d9a"
}
