{
  "schema_version": "2.0",
  "video_id": "recognition-c21-c22",
  "episode_content_hash": "3fb295f92016e37660be9fa4a863ffb6c0b280abfeb47d04c793fe3c163b0d3f",
  "status": "planning_only_content_approval_required",
  "local_route": [
    "schema and evidence validation",
    "storyboard contact sheet",
    "low-resolution animatic",
    "offline narration",
    "assembly and QA"
  ],
  "remote_route": "disabled_pending_content_approval_and_separate_exact_authorization",
  "estimated_cpu_minutes": 150.0,
  "resource_class": "deterministic-cpu-render-candidate",
  "retry_class": "chapter_hash_identical_only",
  "cache_identities": [
    "113eff4d8563baa1b254c0a9e9a13853d31838b1cc51eef7d5c44ccf7f17a8c0",
    "a078c25e64c3bc48fba3a7fc25edf82ea5838131077d6fd9d633b68d2fa06406",
    "89d7695fad1580f3548f04b1ae463437f8ff595f14c0ba7271c4494e17305f15",
    "ea9db2da6b6475491a86fc175438d49b13585bb8c6a1c9ae81f5b2b93afb4076",
    "bf6a45668c7384a4283a126792ec8e7244d870a90f0e6521ca4fb0e8844bacaf"
  ],
  "expected_outputs": [
    "narration-ready 1920x1080 chapter masters",
    "captions",
    "hash and provenance reports",
    "review contact sheet"
  ],
  "illegal_routes": [
    "network or paid render before content approval",
    "RunPod action without separate exact authorization",
    "generative imagery or video",
    "publication"
  ],
  "content_hash": "dae5242ac8da736a0dd36f463e1b240e6ca6511258f8500e076723d8cecd411c"
}
