{
  "schema_version": "2.0",
  "video_id": "conceptual-vs-measured",
  "episode_content_hash": "d64724b7f8a77bbc097596428e17c33e1e212a73a32bed8f85802970b0912e01",
  "status": "planning_only_content_approval_required",
  "local_route": [
    "schema and evidence validation",
    "storyboard contact sheet",
    "low-resolution animatic",
    "offline narration",
    "assembly and QA"
  ],
  "remote_route": "disabled_pending_content_approval_and_separate_exact_authorization",
  "estimated_cpu_minutes": 52.5,
  "resource_class": "deterministic-cpu-render-candidate",
  "retry_class": "chapter_hash_identical_only",
  "cache_identities": [
    "3224fa0f89aa593e56f63101ced77a073ee00597564a640acd6bf82692e866e7",
    "19a1a2042b6ea5c358f6d289c8f49385af70c9a8188e76829ab5a161207e4c47",
    "835b4fb0e214c5c67d75947ae1c28b27d0ddb5e8a6bd02b2a0bb1423a6b33ff6"
  ],
  "expected_outputs": [
    "narration-ready 1920x1080 chapter masters",
    "captions",
    "hash and provenance reports",
    "review contact sheet"
  ],
  "illegal_routes": [
    "network or paid render before content approval",
    "RunPod action without separate exact authorization",
    "generative imagery or video",
    "publication"
  ],
  "content_hash": "0a973d5b79406bec414967f36e2f87c9b37cc8fb507a0641c4ef68571f79fd66"
}
